<?xml version="1.0" encoding="UTF-8"?>
<dictionary
        xmlns:xsi="http://www.w3.org/2001/XMLSchema-instance"
        xsi:noNamespaceSchemaLocation="dictionary-schema.xsd"
        language_local_name="Русский"
        default="true">

    <replies>
        <reply key="start" markdown="true">*Добро пожаловать!*</reply>
        <reply key="start_first_time" markdown="true">*Добро пожаловать!*<br/>Для начала введите ваш регистрационный номер. Чаще всего это номер Вашего СНИЛС. Вводите его в формате 000-000-000 00.<br/>Если по какой-либо причине у вас его нет, введите свой личный номер, полученный при регистрации.</reply>

        <reply key="register_complete">Вы успешно зарегистрировались</reply>
        <reply key="register_wrong_num">Введен неверный регистрационный номер. Пожалуйства, повторите попытку.</reply>

        <reply key="select_lang" format="true" markdown="true">Выберите язык среди поддерживаемых.<br/>На данный момент к ним относятся:<br/>*<arg q="%s" name="supported_langs"/>*<br/>В ответ напишите код необходимо вам языка.<br/>_In response, write the code of the language you need_</reply>
        <reply key="lang_selected">Язык успешно изменен</reply>
        <reply key="lang_not_found">Язык не найден. Попробуйте повторить попытку</reply>
    </replies>

    <words>
        <word key="word">Слово</word>
    </words>
</dictionary>
